number,title,abstract,applicant,publicNumber,publicDate,applicationNumber,applicationDate,IPCmain,IPC
5,Fragmentation Munition With Limited Explosive Force,"A Fragmentation Munition Has A Fragmentation Canister Containing Preformed Fragments, And An Explosive Cartridge That Fits Into A Central Hole In The Fragmentation Canister. The Explosive Cartridge Includes An Outer Shell, And An Explosive Within The Outer Shell. The Munition May Be Configured To Precisely Deliver Fragments To A Relatively Small Area, Such As An Area That Is A Few Meters In Radius. Toward That End The Explosive May Be Configured Primarily To Rupture The Housing And Secondarily To Spread Fragments Over A Limited Area. The Main Kinetic Energy Of The Fragments Is From The Acceleration They Gain As Part Of The Munition Falls From A Launcher, Such As A Carrier Aircraft. The Dispersed Fragments May Have A Similar Downward Velocity After Controlled Dispersal By The Explosive, Allowing Them Considerable Kinetic Energy (Considerable Penetrating Power), But With A Precisely Controlled Dispersal Area.",Raytheon Company,US9739583B2,2017/8/22 0:00,US14453991,2014/8/7 0:00,F42B12/32,F42B12/32;F42B12/20
87,Method For Determining Threat Status For Combat Aircrafts,"The Invention Relates To A Method For Decision Support Of A First Combat Aircraft (1) In A Combat Situation Comprising The Steps Of: A) Detecting (3) A Second Combat Aircraft (2), Wherein The Second Combat Aircraft (2) Is Different From The First Combat Aircraft (1), B) Analyzing (4) The Second Combat Aircraft (2) To Determine Its Type, Its Sensor Capacity And Its Total Weapons Capacity, And C) Recording (5) The Sensor Capacity And The Total Weapons Capacity Of The Second Combat Aircraft (2) To Determine A First Geographic Zone Adapted For Defining The Detection Limit Of The Second Combat Aircraft (2) And A Second Geographic Zone Adapted For Defining A Shoot-Down Limit Of The Second Combat Aircraft (2), Respectively, Wherein The First And The Second Geographic Zone Are Adapted For Decision Support Of The First Combat Aircraft (1) In The Combat Situation With The Second Combat Aircraft (2). In This Way, A Possibility Is Provided To Assist The Pilot In Decision Support In Complicated Combat Situations While Being Reliable, Fast And Easy To Handle For The Pilot In Order To Make A Quick And Efficient Decision.",Anders Lundqvist; Vibeke Kensing,US8909394B2,2014/12/9 0:00,US14352280,2012/2/16 0:00,G05D1/00,G05D1/00;F41G3/22
89,A Thermally Concealed Laser Combat Robot With Reconnaissance Function,"The Invention Discloses A Thermally Concealed Laser Combat Robot With A Reconnaissance Function, Which Includes A Wheel-Crawler Robot Platform. The Wheel-Crawler Robot Platform Includes A Chassis Cabin And Crawler Walking Mechanisms Arranged On The Left And Right Sides Of The Chassis Cabin. A Turret Mounting Seat Is Installed On The Top Plate Of The Chassis Cabin Body, And The Turret Mounting Seat Is Connected To The Bracket Through A Rotary Joint That Can Rotate Infinitely 360 Degrees In The Horizontal Direction. The Bracket Is Equipped With A Laser Cannon, A Multi-Tube Cannon And A Laser Generator. The Laser Cannon Is Connected With A Laser Generator, And The Laser Generator Is Connected With A Control Cabinet Arranged On The Chassis Cabin; The Front End Of The Chassis Cabin Is Provided With A Laser Radar. The Invention Has Good Ability To Climb And Overcome Obstacles, Has The Ability To Survive In High Temperature, Explosion And Strong Corrosion Environments, Has Excellent Infrared Stealth And Detection Functions, And Uses Laser Cannons To Instantly And Silently Strike Enemy Equipment And Personnel As Well As The Function Of Short-Term Blindness, It Also Has Better Self-Defense.",Ren Qubo,CN105605980A,2016/5/25 0:00,CN201610025625.2,2016/1/14 0:00,F41H13/00,F41H13/00
100,Suicide Bomber Blast Threat Mitigation System,"A Non-Lethal, Sabot-Deployed Blast Shield Mitigates A Suicide Bomber By Wrapping Around The Bomber And Positioning A Plurality Of Protective Layers Over An Explosive Device To Absorb Emitted Heat, Shock Waves, And Projectiles If The Device Is Detonated. Stand-Offs Such As Inflatable Beams Or Pillows Provide Break-Away Zones Between The Protective Layers, Allowing Some Layers To Expand To A Point Of Failure And Absorb The Maximum Possible Energy. Inner Layers Absorb Shock Waves And Heat. One Or More Outer Layers Resist Projectile Penetration. Protective Layers Can Be Positioned On Opposing Sides Of A Suspect In Case Two Explosive Devices Are Present. Shields Can Deploy With Sufficient Energy To Knock Down A Bomber. In Embodiments, A Plurality Of Shields Can Be Applied Without Interference Therebetween. In Some Embodiments, A Round Shield Includes Bolas Which Spread The Shield In Flight In A Cast-Net Dynamic And Wrap Around The Suspect For Shield Attachment.",Charles A Howland,US8468925B2,2013/6/25 0:00,US13102070,2011/5/6 0:00,F41H5/04,F41H5/04;F41H5/08;F42B12/00;F42B14/06
120,Fragmentation Munition With Limited Explosive Force,"A Fragmentation Munition Has A Fragmentation Canister Containing Preformed Fragments, And An Explosive Cartridge That Fits Into A Central Hole In The Fragmentation Canister. The Explosive Cartridge Includes An Outer Shell, And An Explosive Within The Outer Shell. The Munition May Be Configured To Precisely Deliver Fragments To A Relatively Small Area, Such As An Area That Is A Few Meters In Radius. Toward That End The Explosive May Be Configured Primarily To Rupture The Housing And Secondarily To Spread Fragments Over A Limited Area. The Main Kinetic Energy Of The Fragments Is From The Acceleration They Gain As Part Of The Munition Falls From A Launcher, Such As A Carrier Aircraft. The Dispersed Fragments May Have A Similar Downward Velocity After Controlled Dispersal By The Explosive, Allowing Them Considerable Kinetic Energy (Considerable Penetrating Power), But With A Precisely Controlled Dispersal Area.",Raytheon Company,US20160231096A1,2016/8/11 0:00,US14453991,2014/8/7 0:00,F42B12/32,F42B12/32
182,Method For Duel Handling In A Combat Aircraft,"The Invention Relates To A Method For Decision Support Of A First Combat Aircraft In A Duel Situation With A Second Combat Aircraft. The Method Comprises The Steps Of: A) Determining (3) A First Plurality Of Combat Value Parameters Of The First Combat Aircraft (1) And Determining (3) A Second Plurality Of Combat Value Parameters Of The Second Combat Aircraft (2), Wherein The Second Combat Aircraft (2) Is Different To The First Combat Aircraft (1), B) Analyzing (4) The First And The Second Plurality Of Combat Value Parameters Determined In The Previous Step (Step A)) By Fitting The First And The Second Plurality Of Combat Value Parameters To A Predefined Model, And C) Combining (5) The First Plurality Of Combat Value Parameters Analyzed In The Previous Step (Step B)) To Calculate A First Value And Combining (5) The Second Plurality Of Combat Value Parameters Analyzed In The Previous Step (Step B)) To Calculate A Second Value, Wherein The First Value And The Second Value Are Compared To Each Other To Determine The Optimum Success Probability Data Of The First Combat Aircraft (1) And Of The Second Combat Aircraft (2) Adapted For Decision Support In The Duel Situation. In This Way, A Reliable And Fast Tool For The Pilot Is Provided While The Tool Is Easy To Handle And Assists The Pilot In Order To Make A Quick And Efficient Decision In Duel Situations.",Anders Lundqvist; Vibeke Kensing,US9092724B2,2015/7/28 0:00,US14352131,2012/2/16 0:00,G06G7/48,G06G7/48;F41G9/00;G06N7/00
252,Method For Determining Threat Status For Combat Aircrafts,"The Invention Relates To A Method For Decision Support Of A First Combat Aircraft (1) In A Combat Situation Comprising The Steps Of: A) Detecting (3) A Second Combat Aircraft (2), Wherein The Second Combat Aircraft (2) Is Different From The First Combat Aircraft (1), B) Analyzing (4) The Second Combat Aircraft (2) To Determine Its Type, Its Sensor Capacity And Its Total Weapons Capacity, And C) Recording (5) The Sensor Capacity And The Total Weapons Capacity Of The Second Combat Aircraft (2) To Determine A First Geographic Zone Adapted For Defining The Detection Limit Of The Second Combat Aircraft (2) And A Second Geographic Zone Adapted For Defining A Shoot-Down Limit Of The Second Combat Aircraft (2), Respectively, Wherein The First And The Second Geographic Zone Are Adapted For Decision Support Of The First Combat Aircraft (1) In The Combat Situation With The Second Combat Aircraft (2). In This Way, A Possibility Is Provided To Assist The Pilot In Decision Support In Complicated Combat Situations While Being Reliable, Fast And Easy To Handle For The Pilot In Order To Make A Quick And Efficient Decision.",Anders Lundqvist; Vibeke Kensing,US20140277852A1,2014/9/18 0:00,US14352280,2012/2/16 0:00,F41G3/22,F41G3/22
294,Method For Stacking A Vehicle On Top Of Another Similar Vehicle And Stackable Vehicle For Performing The Method,"The Present Invention Relates To A Method For Stacking A First Motor Vehicle On Top Of A Second Motor Vehicle, The Method Comprising The Steps Of: Providing A Group Of Rear Tilting Members At The Rear Part Of The Lower Vehicle, Which Will The Rear Part Of The Roof Of The Cabin Of The Lower Vehicle Is Connected To The Ground; A Group Of Front Tilting Members Or Supports Are Provided In The Front Part Of The Roof Of The Cabin Of The Lower Vehicle, The Group Of Front Tilting Members Or The Support Allows The Front Wheels Of The Upper Vehicle To Roll On It; The Upper Vehicle Rolls On The Rear Tilting Member Of The Lower Vehicle, So That The Upper Vehicle Rises Or Climbs From A Position On The Ground To The Top Of The Roof Of The Lower Vehicle Continue To Roll The Upper Vehicle On The Roof Of The Lower Vehicle Until It Reaches The Final Stacking Position Indicated By The Stop Device. In The Final Stacking Position, The Front Wheel Of The Upper Vehicle Rests On The Front Of The Lower Vehicle. The Rear Wheel Of The Upper Vehicle Rests On The Rear Inclined Member Of The Lower Vehicle, Wherein The Upper Vehicle And The Lower Vehicle Are Substantially Vertically Aligned, And The Front Wheels And Rear Wheels Of The Upper Vehicle In The Final Resting Position The Height Of Is Lower Than The Height Of The Roof Of The Lower Vehicle; The Upper Vehicle Is Fixed To The Lower Vehicle By A Suitable Fastening Device, Wherein The Fastening Force Of The Fastening Device Is Preferably Such That The Suspension Of The Upper Vehicle Is Compressed By About 3 To 5 Cm, So Reduce The Overall Height Of The Vehicle Stack; And Remove, Fold Or Shrink Part Or All Of The Rear Tilting Member Of The Lower Vehicle. In Addition, The Present Invention Relates To A Vehicle That Can Perform The Stacking Method. The Vehicle Includes A Vehicle Body, The Vehicle Body Includes Four Wheels And A Cabin With A Roof; A Pair Of Front Tilting Members Or Supports, Which Are Located On The Roof Of The Cabin At The Two Sides Of The Front End; And A Pair Of Rear Tilting Pieces, Which Are Located At The Two Sides Of The Rear End Of The Roof Of The Cabin. Stackable Vehicles Also Include Means For Rapid Aerial Deployment (Airdrop) Of Vehicles Transported In A Stack In A Transport Plane.",Ferri Pronello; Ericeto A Pronello,CN108698533A,2018/10/23 0:00,CN201680081962.1,2016/12/16 0:00,B60P3/08,B60P3/08;B62D47/00;F41A23/26
316,Method For Recognizing Connection State Of Two-Way Initiating Device Plug,"A Method For Identifying The Connection State Of A Two-Way Pyrotechnic Device Plug, Which Includes A Bomb-Loaded Computer Plug, An Pyrotechnic Device Plug, And A Test Equipment Plug; The Computer-Loaded Plug, The Pyrotechnic Product Plug, And The Test Equipment Plug Are Based On Their Original Pins. Four Pins Have Been Added; In Addition, The On-Board Resistance Detection Circuit Is Added To The On-Board Computer Connected To The Plug Of The Missile-Borne Computer, And The Test Equipment Resistance Detection Circuit Is Added To The Test Equipment Connected To The Test Equipment Plug; The On-Board Resistance Detection Circuit, The Resistance Detection Circuit Of The Test Equipment Is Matched With The Four Additional Pins Of The Computer Plug, The Pyrotechnics Plug And The Test Equipment Plug To Accurately Detect The Connection Status Of The Two-Way Pyrotechnics Plug; Therefore, The Air-To-Air Missile Is Completely Installed. After The Operation, Neither The Missile Mount Operator Nor The Pilot Of The Aircraft Could Check The Connection Status Of The Missile-Borne Computer Plug And The Pyrotechnic Device Plug, So That The Risk Of The Missile-Borne Computer Plug And The Pyrotechnic Product Plug Leaking Connection Was Completely Eliminated.","Jiangxi Hongdu Aviation Industry Group Co., Ltd.",CN110320437A,2019/10/11 0:00,CN201910587172.6,2019/7/1 0:00,G01R31/04,G01R31/04;F42B35/00
419,Special Area Intrusion Uav Early Warning Interception Control System,"A Special Area Intrusion Drone Early Warning And Interception Control System, Including A Detection And Disposal System And A Control Command System. The Detection And Disposal System Includes: An Electronic Signal Command Detection And Acquisition Module, A Radar Detection Module, An Optical Matrix Remote Detection System, And A Takeover Control Module , Uav Remote Control Signal Data Link Blocking Interference Module, Netting Transmission Module, Signal Data Orientation Module And Navigation Interference Signal Transmission Module; The Control Command System Includes Server, Approval Control Unit, Uav Database Module, Uav Data The Comparison Module And The Navigation Data Module; The Communication Connection Is Established Between The Two Systems And Between The Parts Of Each System Respectively Through Wired Or Wireless Means. The Advantages Of The Present Invention Are: By Arranging A Plurality Of Detection And Disposal Systems In A Circle, The Foreign Drones Are Detected, Monitored And Identified In The Identification Area, And Illegally Invaded Drones Are Dealt With Before Entering The Core Protection Area To Ensure The Security Of The Core Protected Area.",Zhang Hongbin,CN106839882B,2018/12/28 0:00,CN201710047228.X,2017/1/22 0:00,F41H11/02,F41H11/02
421,A Mobile Multi-Point Arrangement Blasting Remote Control Vehicle Used In Dangerous Environment,"The Invention Provides A Mobile Multi-Point Arrangement Blasting Remote Control Vehicle For Dangerous Environments, Which Is Composed Of A Supporting Frame, A Radio Communication Module, A Vertical Roller Mechanism, An Explosive Carrier, A Rotating Baffle Mechanism, And A Carrier Replacement Mechanism (Two Sets Of Symmetrical Arrangement), The Carrier Output Mechanism, Power Mechanism And Other Auxiliary Parts Are Composed. The Main Function Of The Remote Control Car Of The Present Invention Is To Receive The Remote Control Signal Of The Blaster, Enter The Target Building Under The Control Of The Blaster, And Complete The Placement Of Explosives At A Designated Position In The Building.",Harbin Engineering University,CN107063012B,2018/7/24 0:00,CN201710330005.4,2017/5/11 0:00,F42D1/00,F42D1/00; F42D3/02; F42D5/00
488,Apparatus For Determining Errors Carrying Flight Unmanned Missile And Method Therefor On A Carrier Aircraft Formed A For,"The Device (1) Has A Flight Error Storage Device (17) I.E. Non-Volatile Memory,  For Storage Of Flight Patterns Indicating Defects Of An Unmanned Flying Body I.E. Missile (3). A Transmission Unit (12) Is Arranged For Transmission Of The Flight Patterns From The Storage Device. A Data Cable (2) Is Arranged For Transmission Of Control Signals From The Storage Device To The Missile During Missile Test. The Data Cable Is Arranged For Receiving Output Test Error Patterns From The Missile In Response To The Control Signals From The Storage Device. Independent Claims Are Also Included For The Following :  (1) A Method For Detecting Defects Of An Unmanned Missile (2) A Computer Program Product Comprising Instructions For Performing The Method For Detecting Defects Of The Unmanned Missile.",MBDA Deutschland GmbH,DE102012015363B4,2014/10/23 0:00,DE102012015363,2012/8/6 0:00,F42B35/00,F42B35/00
503,Conveyor Feeder Of Artillery Assault Rifle Artillery Naval Unit,"Field: Military Equipment.
    Substance: Invention Relates To Ammunition Supply To Artillery Installations. Conveyor Feeder Of Artillery Assault Rifle Artillery Naval Unit Comprises Two Conveyors With Chain Traction And Truck Carrying Load-Carrying Elements. Artillery Unit Machine Trunnion Bracket Are Supporting And Guiding Structures Of Conveyors. Conveyor Is Formed By Chain Of Articulated Modular Trolleys With Support Rollers And Running Roller. Each Bogie Has A Unit For Fixing A Single-Piece Cartridge For Holding And Displacing A Shot Into The Artillery Machine Gun Receivers. Movement Of Conveyor Chain Is Carried Out By Interaction Of Running Rollers With Sprockets Of Single Chain Drive. Sprockets Rotation Is Performed Due To Gimbal Transmission.
    Effect: Providing Stable Position Of Conveyor Feeder Modular Truck, Simplifying Design And Improving Artillery Naval Unit Reliability.
    1 Cl, 13 Dwg",OTKRYTOE AKTSIONERNOE OBSHCHESTVO MASH ZAVOD ARSENAL,RU2694485C1,2019/7/15 0:00,RU2018122016,2018/6/14 0:00,F41A9/04,F41A9/04
628,Vehicle-Mounted Anti-Uav Monitoring And Intercepting Device,"A Vehicle-Mounted Anti-Uav Monitoring And Intercepting Device Belongs To The Technical Field Of Uav Security Defense, And Particularly Relates To An Anti-Uav Monitoring And Intercepting Device, Including Off-Road Vehicles, Radar Early Warning Systems, Intelligent Monitoring Systems, And Storage Systems. Energy Box, High And Low Angle Adjuster And Electronic Interference System. When The Drone Enters The Protected Area, The Radar Early Warning System Scans The Drone And Transmits The Signal To The On-Board Control Center. The On-Board Control Center Controls The Electronic Jamming System To Transmit Interference Signals In The Frequency Band Where The Drone Is Located To Interfere With Its Uplink And Downlink. The Frequency Band Signal Transmission Makes The Remote Control Fail, And The Captured Images And Videos Cannot Be Transmitted Back, Forcing The Drone To Hover And Land In The Air, Completely Cutting Off The Connection Between The Drone And The Remote Control Or Ground Station. The Invention Can Realize The Interception Of Various Types Of Uavs And Track Low- And Medium-Speed Uavs, And Adopts A Vehicle-Mounted Uav That Can Flexibly Inhibit Illegal Intrusion.","Foshan Shenfeng Aviation Technology Co., Ltd.",CN107062993A,2017/8/18 0:00,CN201710365636.X,2017/5/22 0:00,F41H11/02,F41H11/02; G05D3/12
720,Multimode Unmanned Aerial Vehicle,"Problem To Be Solved: To Provide An Unmanned Aerial Vehicle System Comprising An Unmanned Aerial Vehicle (Uav) Provided With A Terminal Homing Mode, And Configured To Deliver A Payload To A Target.
    Solution: The Uav 410 May Be In A Racetrack Of Circular (I.E. Rotation About A Ground Point Or Positional Target) Or Other Flight Pattern 420 As Part Of A Target Search Mode, Loiter Mode, Surveillance Mode, Reconnaissance Mode And/Or Other Observation Mode. The Seeker Processing Together With A Guidance Processing And/Or An Uplink From A Command Node, E.G. A Ground Command Node 450, May Place The Uav 410 Into A Terminal Homing Strike Mode 430. The Uav 410 Then May Home On The Ground Target 440, E.G., A Ground Vehicle, In An Effort To Get Close Enough To Effectively Deploy A Payload, Such As Detonating A Warhead, Dropping A Beacon, Or Dispensing A Pigment, And/Or Effect A Collision With The Target.
    Copyright: (C)2016,Jpo&Inpit",AEROVIRONMENT,JP2015212617A,2015/11/26 0:00,JP2015126773,2015/6/24 0:00,F41G7/22,F41G7/22;B64C13/18;B64C13/20;B64C39/02;B64D47/08;F42B10/60;F42B10/64;F42B15/01
729,Stationary Complex For Detection And Destruction Of Small-Size Unmanned Aerial Vehicles,"Field: Weapons; Aviation.
    Substance: Stationary Complex Of Detection And Destruction Of Small-Size Unmanned Aerial Vehicles (Uavs) Is Installed In Zone Of Alienation After Protected Perimeter Of Important Object. It Is A Stationary Complex For Detecting And Destructing A Spacecraft With A Distinctive Feature In A Concrete Conical Structure Installed In The Ground, In The Lower Part Of The Cone There Is A Breech Unit With An Electric Detonator, High-Explosive Ammunition Is Laid In The Breech, Above The High-Explosive Ammunition There Is An Obturating Wad Made From Incombustible Material; On Top The Conical Structure Is Filled With Fine-Dispersed Substance In Amount Of 1500 Kilograms And Placed Above The Wad. Opening Angle Of Cone Is 45 Degrees, Which Provides Wide Grip Of The Target At Altitude Of 120¨C150 Meters, When The Stationary System Is Actuated By Breaking The High-Explosive Ammunition, A Large Cloud Of Fine-Dispersed Substance Is Emitted, Damaging Aerodynamic Rudders And Reconnaissance Means.
    Effect: Technical Result Is Increasing Destructive Power Of Stationary Means Of Combatting Small-Size Drones.
    1 Cl, 2 Dwg",FEDERALNOE GOSUDARSTVENNOE KAZENNOE VOENNOE OBRAZOVATELNOE UCHREZHDENIE VYSSHEGO OBRAZOVANIYA VOENNA,RU2734267C1,2020/10/14 0:00,RU2019126367,2019/8/20 0:00,F41H11/02,F41H11/02
741,Management System Of Several Snipers,"The Invention Relates To A Guidance And Control System And Can Be Used For Anti-Terrorist Operations To Release The Hostages Or Neutralize Self-Explosion Acts Performed By Suicide Bombers Or For Military Sniper Operations. The Technical Effect: Synchronous Targets Firing From Different Firing Positions, Increasing An Accuracy Of Target Firing, Guidance Correction Of Precision Weapon. Substance: A Management System Of Several Snipers Consists Of Several Individual Sniper Kits, A Mobile Relay Kit And A Mobile Central Station Kit. Each Individual Kit Consists Of A Radio Facility For Verbal Radio Communication And A Sniper Rifle With Optical Sight. A Laser Target Designator And A Laser Rangefinder With Photosensor, A Sniper Standby Sensor, A Small-Sized Video Camera With Guided Zoom-Lens, A Firing Pin Remote Activation Device, A Wman Radiomodem, A Satellite Navigational Receiver And Other Equipment, A Bipod Are Installed On The Rifle, Additionally. A Relay Station Is Standard Base Station Equipment Of Wman Technology On A Mobile Platform. The Central Station Equipment Consists Of Radio Facilities For Verbal Radio Communication, A Forming And Selection Equipment Of Control Instructions, Several Wman Radiomodems, A Videomultiplexor, Two Videomonitors, And A Satellite Navigation Receiver, A Weather Station With Sensors, A Ballistic Calculator And Other Equipment. According To The Second Modification, The Central Station Equipment Automatically Remote Controls The Sight Adjustments Of Individual Kit In Accordance With The External Conditions Changes.",BRYLEV Sergey Fedorovich,WO2012138242A1,2012/10/11 0:00,WORU11000222,2011/4/5 0:00,F41G3/00,F41G3/00;F41G5/06
766,Weekly Sighting And Aiming System For Turning Shooting Gun,"The Invention Relates To A Peripheral Sighting And Sighting System For A Turning Shooting Gun. The Sighting System Includes A Finder Optical System With A Red Dot Sighting, A Differential Mechanism And A White Light Imaging System; The Platform Operating Mechanism Of The Sighting And Sighting System And The Upper And Lower Rotating Shafts Are Fixedly Connected Between The Weapon And Combat Mechanisms, And The Shaft Is Driven By The Electric Corner Actuator; The Pistol And Other Weapons Are Fixed On The Fixed Bracket Of The Weapon Combat Mechanism, And The Steel Cable Of The Pistol Firing Mechanism In The Bracket Is Controlled By The Platform Operating Mechanism And The Trigger. Firing Insurance; The Tactical Rail Of The Weapon Combat Mechanism Can Be Installed With Camera/Video And Audio Wireless Transmitters, Tactical Lasers, And Tactical Lights. This Is An Improved Invention And Creation Of The Original Pistol'S Variable-Line Aiming And Shooting Tactical Operating Platform. Wei Prism And Red Dot Rifle Sight Improve The Accuracy Of The Optical System. Due To The Addition Of Free Target Rotation, The Relationship Between Man And Machine Is More Reasonable And The Platform Is More Applicable. Therefore, It Has Obvious Economic Benefits.",Bai Shizhong,CN102393162A,2012/3/28 0:00,CN201110370859.8,2011/11/21 0:00,F41G1/46,F41G1/46
880,A Fixed Anti-Uav Interception Net System,"The Invention Relates To A Fixed Anti-Uav Interception Net System Including An Interception Net Body, A Traction Net Body Rocket Device, A Collision Air Foaming Impact Device And An Electromagnetic Guide Device. It Is Characterized In That The Interception Net Body Adopts A Mesh-Like Object Woven By High-Strength, High-Modulus Polyethylene Fiber And Intelligent Communication Conductive Fiber, And An Information, Intelligent, And Perceptual Device Installed On The Interception Net Body, Which Realizes The Realization Of Small, Low-Altitude, Slow The Early Warning Interception Function Of High-Speed, Spiral-Wing Uav. When The Drone Strikes, The Traction Mesh Rocket Device Carries The Interception Mesh Body And Rises To The Highest Point. The Mesh Body Is Suspended In The Air. The Electromagnetic Guidance Device Is Used To Gather The Mesh Body To Form A Net Bag To Achieve Accurate And Efficient Interception And Capture. Man-Machine Function. The Invention Has The Characteristics Of Intelligent Interception, Stable Performance, Accurate Positioning, High Sensitivity, Simple Operation, Etc., And Can Be Used For Intercepting Small, Low-Altitude, Slow-Speed, Spiral-Wing Drones In The Air.","Shanghai Yinai New Material Technology Co., Ltd.",CN105651120A,2016/6/8 0:00,CN201610062946.X,2016/1/30 0:00,F41H11/04,F41H11/04
