number,title,abstract,applicant,publicNumber,publicDate,applicationNumber,applicationDate,IPCmain,IPC
2380,"Reconnaissance Position Computing Apparatus, Reconnaissance Position Computing Method, And Reconnaissance Position Computing Program","Problem To Be Solved :  To Compute A Proper Reconnaissance Position For An Aircraft That Performs Reconnaissance.
    Solution :  An Aircraft 10 Comprises A Memory 15 That Is For Computing A Reconnaissance Position Sp For Reconnoitering A Predetermined Reconnaissance Target Area Ra And Stores Map Data 155 Including At Least The Reconnaissance Target Area Ra,  And A Control Part 18. The Control Part 18 Divides The Map Data 155 Stored In The Memory 15 Into A Plurality Of Gridded Cells C In A Horizontal Plane. The Control Part Computes A Los Score P,  In Which Easiness Of Viewing From Own Aircraft And Difficulty Of Being Viewed From A Reconnaissance Target Are Quantified,  For Each Of Plural Candidate Cells Ca Among The Plurality Of Cells C Excluding Reconnaissance Target Cells Rc Included At Least In The Reconnaissance Target Area Ra,  And Sets The Reconnaissance Position Sp On The Basis Of The Los Score P.
    Selected Drawing :  Figure 1
    Copyright :  (C)2017, Jpo&Inpit",SUBARU CORP,JP2017172877A,2017/9/28 0:00,JP2016059769,2016/3/24 0:00,F41H13/00,F41H13/00; B64D47/00; F41H11/00; G08G5/00
2400,System And Method For Setting Fuse Data And Ammunition Data Based On Rfid,"The Present Invention Relates To A System And A Method For Inputting Fuse Data And Ammunition Data Based On Rfid, Which Can Input The Fuse And Ammunition Data Using An Rfid Tag And A Reader, And Can Input Multiple Data According To An Application Environment. The System Comprises: An Input Unit For Inputting The Fuse And The Ammunition; The Rfid Tag Mounted On The Fuse And Receiving And Recording Input Data Transmitted From The Input Unit And Transmitting An Authentication Signal Through An Antenna; A Fuse Or Ammunition Electric Unit For Receiving The Input Data Through Data Communication From The Rfid Tag And Processing The Input Data; And An Rfid Reader For Receiving And Reading A Signal Transmitted From The Rfid Tag.(10) Input Machine(11) Rfid Reader(21) Fuse Or Ammunition Electric Unit(21A) Input Signal Processing Unit(22) Rfid Tag(Aa) Input Data(Bb) Input Confirmation And Other Data(Cc) Input Data Communicationcopyright Kipo 2018",POONGSAN CORPORATION,KR1020180097331A,2018/8/31 0:00,KR1020170024188,2017/2/23 0:00,F42C17/04,F42C17/04;F42C11/00;F42C19/06;G06K7/10;G06K19/07
2411,Orbital Device With Stowable Mount,"A Weapon/Recon Mount Device, Comprising: A Base Ring Fixable To A Vehicle; A Slewing Ring Concentric With And Rotatable Relative To The Base Ring; A Pivot Mount Attached To The Slewing Ring And Having A Stowed State And A Deployed State; And A Back Rest Attached To The Slewing Ring And Having A Stowed State And A Deployed State.",PRADO PAUL; LOPEZ LARRY; BEAZER ERIC,US20110277622A1,2011/11/17 0:00,US12931600,2011/2/3 0:00,F41A23/34,F41A23/34;B23P11/00;F41G3/00
2415,Orbital Device With Stowable Mount,"A Weapon/Recon Mount Device, Comprising: A Base Ring Fixable To A Vehicle; A Slewing Ring Concentric With And Rotatable Relative To The Base Ring; A Pivot Mount Attached To The Slewing Ring And Having A Stowed State And A Deployed State; And A Back Rest Attached To The Slewing Ring And Having A Stowed State And A Deployed State.",Paul Prado; Larry Lopez; Eric Beazer,US8584573B2,2013/11/19 0:00,US12931600,2011/2/3 0:00,F41A23/00,F41A23/00
2463,System And Method Of Bullet Trajectory Research,"The Invention Relates To A Bullet (1) Trajectory Inspection System, Which Comprises: A Shelling Medium (2), Wherein The Shelling Medium (2) Is Formed Of A Homogeneous Material That Can Be Analyzed By X-Rays; -Bombers (3); A Grating (11) For Determining The Velocity At Which The Bullet (4) Enters The Bombardment Medium (2); A Tomography Unit (5) For Detecting The Bombardment Effect In The Bombardment Medium (2); An Analysis Unit (6), In Particular For Calculating And Processing Tomographic Data To Generate A 3-D Model (8) And A-3-D Display Unit (9A) And/Or A 3-D Output Unit (9A), Wherein The 3-D Display Unit (9A) And/Or The 3-D Output Unit (9B) Provide A Spatial Positive Image, A Spatial Positive Image With Bullet Fragments,",Carl Gremse,DE102017000486A1,2017/7/27 0:00,DE102017000486,2017/1/18 0:00,F42B35/00,F42B35/00;B29C64/106;B33Y80/00;G01B15/04;G01N23/04
2513,The Method Of Calculating Missile-Masking Area And The Operational Method Using That,"The Present Invention Relates To A Method For Calculating A Missile Masking Area,  Comprising The Steps Of :  Loading A Model Of The Fuselage Of A Fighter Aircraft;  Extracting The Position Of An Armed Seeker Applied To The Fuselage And Setting The Same As A Reference Position;  Calculating A Masking Area Which Is A Visual Field Blocking Area By The Fuselage,  At The Reference Position;  Storing Information On The Masking Area. According To The Method For Calculating A Missile Masking,  The Problem Of Visual Field Blocking Of A Missile Seeker Which Can Occur During An Actual Weapon Operation Stage Can Be Determined In Advance By Calculating The Masking Area Using Non-Real-Time Simulation Modeling,  And Data For Selecting Another Missile Is Provided If There Is A Problem. Therefore,  It Is Possible To Have An Advantage In An Urgent Air-To-Air Combat.","Korea Aerospace Industry Co., Ltd",KR101838679B1,2018/3/14 0:00,KR1020160086021,2016/7/7 0:00,F42B15/01,F42B15/01; F41G7/00; F41G9/00; F42B15/10
2519,Method Of Landing Space Rocket During Launch Of Carrier Aircraft And Aircraft Launching Apparatus,"Field :  Aviation.Substance :  Group Of Inventions Relates To Aerospace Engineering,  Particularly To A Method Of Landing Space Rocket And To Aircraft Rocket Launcher. Method Of Landing Space Rocket From Carrier Aircraft Consists In Starting From Transporter-Launcher Container And Ejection Thereof Under Action Of Piston Force Created By Excess Gas Pressure In A Sealed Cavity. Sealed Cavity Is Formed Between Bottom Of Container And Rigid Tray Fixed On Tail Part Of Rocket. Aircraft Launcher Comprises Fixed In Cargo Compartment Of Carrier Aircraft Transporter-Launcher Container With Bottom And Open End,  Energy Rocket Ejection Device,  Support-Drive Belts Device For Holding Rocket In Container And Sealed Tray. Container Is Oriented In Aircraft Tail And Is Equipped With A Sealing Device. Tray Is Equipped With Power Flange Extending Beyond Middle Of Rocket And Connected With Retainers Thereof In Container.Effect :  Method Of Launching Rocket From Aircraft Carrier.4 Cl,  8 Dwg","Aktsionernoe obshshestvo ""Gosudarstvennyj raketnyj tsentr imeni akademika V P Makeeva""",RU2595742C1,2016/8/27 0:00,RU2015115454,2015/4/23 0:00,F41F3/06,F41F3/06
2520,Combat Robots Set,"Field :  Weapons And Ammunition.Substance :  Invention Refers To A Combat Robot And Is Designed To Destroy And Unmask The Enemy On The Battlefield. The Combat Robot Consists Of A Mobile Unit Controlled By A Remote Control Panel And Contains Two High-Voltage Dc Motors,  Contains A Submachine Gun Which Is Always Directed Forward And Has A Spring Vertical Suspension Permanently Directed Horizontally,  Which Can Be Deflected Upwards Or Sideways From The Submachine Gun Recoil Action,  And/Or Has A Flamethrower.Effect :  Ability To Detect The Enemy And Destroy Him.7 Cl,  3 Dwg",Staroverov Nikolaj Evgenevich,RU2618352C1,2017/5/3 0:00,RU2015149596,2015/11/18 0:00,F41A23/34,F41A23/34; F41H7/00
2546,"Monitoring System, Management Device, Monitoring Method, And Management Device Control Program","[Problem] To Provide A Monitoring System, A Management Device, A Monitoring Method, And A Management Device Control Program By Which An Intrusion Drone Can Be Found And Continuously Monitored Even When The Intrusion Drone Cannot Be Visually Spotted. [Solution] A Monitoring System 100 Comprises: A Plurality Of Cameras 150A, Etc. Which Are Separately Disposed And Are Capable Of Photographing A Common Region; A Management Device 300 Which Receives Images Acquired By Photographing Performed By The Cameras 150A, Etc.; And An Unmanned Flying Body 1 Which Is Communicable With The Management Device 300. The Management Device 300 Comprises: A First Recognition Means For Recognizing The Object Being Monitored In The Images Received From The Cameras 150A, Etc., By Using Artificial Intelligence Formed With A Neural Network; A Position Calculation Means For Calculating The Position Of The Object Being Monitored, On The Basis Of The Positions Of The Cameras 150A, Etc., And The Direction Of The Object Being Monitored With Respect To Each Of The Optical Axes Of The Cameras 150A, Etc.; And A Position Transmission Means For Transmitting Position Information Indicting The Position Of The Object Being Monitored To The Unmanned Flying Body 1. The Unmanned Flying Body 1 Comprises: A Flying Means For Making A Flight To The Position Indicated By The Position Information When The Position Information Is Received From The Management Device 300; A Photographing Means For Obtaining A Photographed Image By Photographing The Outside; A Second Recognition Means For Recognizing The Object Being Monitored In The Photographed Image By Using Artificial Intelligence Formed With A Neural Network; And A Lock-On Means For Continuously Photographing The Object Being Monitored When The Object Being Monitored Is Recognized.",EAMS LAB CO LTD; IZU Tomoyuki; EAMS ROBOTICS CO LTD,WO2020070897A1,2020/4/9 0:00,WOJP18037486,2018/10/5 0:00,F41J11/02,F41J11/02;B64C13/20;B64C39/02;B64D47/08;G06T7/00;G08B25/00;H04N7/18
2552,Transport Device For Ammunition,"A Consists Of An Outer (1 Fig.) Small Arms Ammunition,  Transportation Apparatus,  [...] /Or Lockable First Box And Close (1) With A Plurality Of Similar,  Smaller,  Inner Steel Tanks (20),  Which Receive The Ammunition To Be Transported (50,  51).  A On All Sides By Spacers [...] Space Forms (32 ;  40,  41) Fixed Air Gaps (A).  These Transport Device Meets The Relevant International Conditions For Transport In Case Of Fire Ammunition [...] Transport Aircraft By Means Of Small Quantities.",RUAG AMMOTEC AG,AT513787A2,2014/7/15 0:00,AT9282013,2013/12/3 0:00,F42B39/00,F42B39/00; F41A9/79; F41A9/84; F42B39/26; F42B39/28
2599,Control Method Of A Sensor On A Combat Aircraft,,SAAB AB,BRPI1418686A2,2017/6/20 0:00,BR112014018686,2012/2/8 0:00,F41H11/02,F41H11/02; F41H13/00; G01S13/66; G01S13/88
2747,Explosion-Proof Board For Fighter'S Mobile Equipment And Fighter'S Mobile Equipment,"The Explosion-Proof Plate For Fighter Aircraft'S Mobile Equipment Provided By The Present Invention Is Used To Form The Shell Of The Fighter Aircraft'S Mobile Equipment, And Includes: A High Molecular Polyethylene Board And A Silicon Carbide Board That Are Attached To Each Other, And The High Molecular Polyethylene Board And The Silicon Carbide Board Pass Through The Foam Layer Between The Two Is Connected. Compared With The Explosion-Proof Board Provided By The Background Technology, The Composite Board Formed By Polymer Polyethylene Board And Silicon Carbide Has High Hardness, Which Can Improve The Explosion-Proof Performance Of Fighter Aircraft. At The Same Time, The Density Of Polymer Polyethylene Board And Silicon Carbide Board Is Lower Than That Of Steel And Iron. , Which Makes The Fighter'S Mobile Equipment Lighter, And Solves The Problem Of Heavy Fighter'S Mobile Equipment And Poor Flexibility. The Invention Also Provides A Fighter Aircraft Mobile Equipment.",Zhou Qidi,CN104215127A,2014/12/17 0:00,CN201310211121.6,2013/5/31 0:00,F41H5/04,F41H5/04; F41H5/00
2748,Explosion-Proof Board For Fighter'S Mobile Equipment And Fighter'S Mobile Equipment,"The Explosion-Proof Plate For Fighter Aircraft'S Mobile Equipment Provided By The Present Invention Is Used To Form The Shell Of Fighter Aircraft'S Mobile Equipment. The Boards Are Connected By A Foam Layer Between The Two. Compared With The Explosion-Proof Board Provided By The Background Technology, The Composite Board Formed By The Aramid Fiber Polymer Board And The Silicon Carbide Board Has High Hardness, Which Can Improve The Explosion-Proof Performance Of The Fighter Aircraft. At The Same Time, The Density Of The Aramid Fiber Polymer Board And The Silicon Carbide Board Is Relative To That Of Steel. , The Low Iron Makes The Fighter'S Mobile Equipment Lighter, Which Can Solve The Problem Of Heavy Fighter'S Mobile Equipment And Poor Flexibility. The Invention Also Provides A Fighter Aircraft Mobile Equipment.",Zhou Qidi,CN104215128A,2014/12/17 0:00,CN201310211132.4,2013/5/31 0:00,F41H5/04,F41H5/04
2749,Explosion-Proof Board For Fighter'S Mobile Equipment And Fighter'S Mobile Equipment,"The Explosion-Proof Plate For Fighter Aircraft'S Mobile Equipment Provided By The Present Invention Is Used To Form The Shell Of Fighter Aircraft'S Mobile Equipment. It Includes: A Carbon Fiber Polymer Plate And A Silicon Carbide Plate That Are Attached To Each Other, And The Carbon Fiber Polymer Plate And The Silicon Carbide Plate Pass Through The Two The Foamed Layers Between Are Connected. Compared With The Explosion-Proof Board Provided By The Background Technology, The Composite Board Formed By Carbon Fiber Polymer Board And Silicon Carbide Has High Hardness, Which Can Improve The Explosion-Proof Performance Of Fighter Aircraft. At The Same Time, The Density Of Carbon Fiber Polymer Board And Silicon Carbide Board Is Lower Than That Of Steel And Iron. This Makes The Fighter'S Mobile Equipment Lighter, And Can Solve The Problem Of Heavy Fighter'S Mobile Equipment And Poor Flexibility. The Invention Also Provides A Fighter Aircraft Mobile Equipment.",Zhou Qidi,CN104215129A,2014/12/17 0:00,CN201310211152.1,2013/5/31 0:00,F41H5/04,F41H5/04
2862,Fog Bomb,A Type Of Fog Bomb That Sprays Mist Paint On The Aircraft Carrier And Carrier-Based Aircraft After The Explosion. It Is Attached To The Observation Window To Lose Its Observation Ability. The Aircraft Carrier Cannot Be Commanded. The Carrier-Based Aircraft Cannot Take Off And Land. The Paint Attached To The Stealth Aircraft After Take-Off Contains Metal Particles That Reflect Radar Waves Lose Their Stealth Ability. The Aircraft Carrier Formation Loses Its Air Superiority And Becomes A Passive Target.,Liu Yongqiang,CN105716476A,2016/6/29 0:00,CN201410715939.6,2014/12/2 0:00,F42B12/48,F42B12/48; F42B12/46
2922,A Missile Warfare System Based On Individual Combat Vehicles,"The Invention Relates To A Weapon System, In Particular To A Weapon System That Uses A Special Individual Combat Vehicle Carrying Multiple Missiles To Carry Out Long-Distance Missile Strangling Dozens Of Kilometers Away. It Mainly Includes Individual Combat Vehicles, Carrier Vehicles, Command Vehicles, Missile Ammunition Supplement Vehicles, Battery And Rechargeable Generator Sets, Miniature Remote Reconnaissance Aircraft, Remote Control Helicopters And Their Remote Control Devices. Eventually, The Land Warfare Will Be Upgraded To Modern Iii Missile Warfare.",Gao wengbin,CN106595393B,2018/4/24 0:00,CN201610875393.X,2016/10/8 0:00,F41H13/00,F41H13/00
2972,A Mobile Multi-Point Arrangement Blasting Remote Control Vehicle Used In Dangerous Environment,"The Invention Provides A Mobile Multi-Point Arrangement Blasting Remote Control Vehicle For Dangerous Environments, Which Is Composed Of A Supporting Frame, A Radio Communication Module, A Vertical Roller Mechanism, An Explosive Carrier, A Rotating Baffle Mechanism, And A Carrier Replacement Mechanism (Two Sets Of Symmetrical Arrangement), The Carrier Output Mechanism, Power Mechanism And Other Auxiliary Parts Are Composed. The Main Function Of The Remote Control Car Of The Present Invention Is To Receive The Remote Control Signal Of The Blaster, Enter The Target Building Under The Control Of The Blaster, And Complete The Placement Of Explosives At A Designated Position In The Building.",Harbin Engineering University,CN107063012A,2017/8/18 0:00,CN201710330005.4,2017/5/11 0:00,F42D1/00,F42D1/00; F42D3/02; F42D5/00
2998,An Anti-Uav System Based On Sound Waves,"The Invention Discloses An Anti-Uav System Based On Sound Waves. The Present Invention First Finds The Position Information Of The Incoming Drone Through The Positioning And Tracking Device And Calculates The Aiming Position Deviation In Real Time, And Transmits It To The Control And Display Device In Real Time. The Control And Display Device Forwards The Aiming Position Deviation To The Sonic Attack Device In Real Time The Servo Module Is Designed To Drive The Sonic Attack Device To Dynamically Aim At The Target Drone In Real Time. When The Target Drone Enters The Early Warning Range, The Control And Display Device Will Display Its Movement Trajectory In Real Time. When The Target Drone Enters The Attack Range, The Sonic The Attack Device Sends An Attack Command To Send A Sound Wave Attack Signal To The Target Drone, Causing The Drone To Resonate And Fall. The Invention Realizes The Method Of Hardly Destroying The Drone In Ordinary And Special Occasions By Emitting Sound Waves That Resonate With The Components Of The Drone, So As To Not Only Effectively Strike The Drone Under Ordinary Circumstances, But Also Effectively Counterattack The Drone Under Special Circumstances. The Goal Of.",University of Electronic Science and technology,CN107339914B,2018/10/16 0:00,CN201710426880.2,2017/6/8 0:00,F41H11/02,F41H11/02; F41H13/00
3153,Mobile Modular Uav Countermeasure System,"In The Mobile Modular Uav Countermeasure System Of The Present Invention, The Uav Detection And Early Warning Module Detects Whether There Is A Uav In The First Set Range Through Radar Detection Technology, And Sends The Detection Result To The On-Site Main Control Module Of The Mobile Station; The On-Site Main Control Module Of The Mobile Station Calls The Uav Photoelectric Tracking Module To Track And Locate The Detected Uav When The Detection Result Is That There Is A Uav Detection Result; The On-Site Main Control Module Of The Mobile Station Receives The Uav Photoelectric Tracking Module The Incoming Drone Tracking And Positioning Information, When It Is Determined That The Current Drone Position Is Within The Second Set Range, The Drone Directional Processing Module Is Called To Suppress The Drone Signal; The On-Site Main Control Module Of The Mobile Station Will Receive The Detected Detection Results, Drone Tracking And Positioning Information And Suppression Results Are Transmitted To The Remote Monitoring Center Through The 4G/Wan Network Connection Module; The Remote Monitoring Center Issues Specific Suppression Instructions And Basic Parameters Of The Front-End Functional Modules To The Mobile Station On-Site Main Control Module Setting.",Shanghai Security Service Corporation,CN108507415A,2018/9/7 0:00,CN201810172272.8,2018/3/1 0:00,F41H11/02,F41H11/02
3234,Method And System For Portable Wireless Fire Control Equipment To Realize Rapid Equipment Control Of Space-Based Weapons,"The Invention Discloses A Method And A System For Realizing Rapid Equipment Control Of An Air-Based Weapon By A Portable Wireless Fire Control Device. The Method Relates To A Portable Wireless Fire Control Device And An Air-Based Weapon. Among Them, Portable Wireless Fire Control Equipment Includes Wireless Communication Modules, Display Screens, Buttons, Etc. In The Method, The Weapon And The Carrier Transmit Information Through The Wireless Communication Module. The Information Includes The Weapon Status And Related Instructions. The Display Screen Can Display The Weapon Status, Fire Control Information, Etc., And The Pilot Sends Instructions To The Weapon Through The Button Control. Activate A Series Of Operations Such As Thermal Battery And Fuze Control. The Invention Can Adapt The Weapon To Mount Different Carrier Aircraft Without Any Modification Of The Carrier Aircraft, Greatly Improve The Compatibility Of The Weapon And The Carrier Aircraft, Without Modification Cost, And Strong Operability. The Invention Has Low Requirements On The Type Of The Carrier Aircraft, Simple Operation, Can Quickly Realize The Equipment Use Of The Weapon, Improves The Adaptability Of The Weapon To The Carrier Aircraft, And Broadens The Market Application Of The Weapon.","Beijing Aerospace Feiteng Equipment Technology Co., Ltd",CN108955397B,2021/3/2 0:00,CN201810807124.9,2018/7/18 0:00,F41H13/00,F41H13/00
3298,A Method To Prevent Aircraft Carrier Carrier Aircraft From Taking Off And Landing,"A Method For Preventing The Take-Off And Landing Of Aircraft Carrier Aircraft, Which Is Characterized By Loading A Certain Number Of Hollow Square Pyramid Shell Objects 3 And A Certain Number Of Colloidal Bombs In The Air-Adhesive Glue Mixture 2 Inside The Missile 7. Each Four-Sided Pyramid Shell Object 3 Has A Central Hole 9 On Each Of The Four Faces; The Gel Bomb 7 Points To The Take-Off Area 1, The Parking Area 5 And The Landing Area 8 Of The Aircraft Carrier Deck And Then Guides The Explosion, Collision And Explosion. The Square Pyramid Shell Object 3 And The Adhesive Mixture 2 Loaded On It Are Quickly Splashed, Covered, Penetrated, And Solidified On The Aircraft Carrier Deck, So That The Surface Of The Aircraft Carrier¡¯S Deck Is Adhered To The Square Pyramid Shell Object 3, Making The Ship On The Aircraft Carrier Deck The Tires Of The Carrier 4 And The Aircraft Carrier Deck Are Bonded By The Adhesive Glue Mixture 2, Making It Impossible For The Carrier Aircraft 4 To Land Smoothly On The Aircraft Carrier Deck After Take-Off, Making The Carrier Aircraft 4 On The Aircraft Carrier Deck Unable To Take Off, Causing The Steam To Eject. , Electromagnetic Ejection And Air Deflector And Other Aircraft Carrier Deck Functional Facilities Failed.",Lu Quansheng,CN109253668A,2019/1/22 0:00,CN201811311212.6,2018/11/6 0:00,F42B12/46,F42B12/46
3342,An Automated Military Unmanned Aerial Vehicle With High Work Efficiency For Mine Clearance,"The Invention Relates To An Automated Military Unmanned Aerial Vehicle With High Work Efficiency For Mine Clearance, Which Includes A Main Body, An Explosive Box, A Plane Moving Mechanism And A Metal Detector. The Explosive Box Is Provided With A Drug Injection Mechanism, And The Drug Injection Mechanism Includes A Storage Tube And A Reset Tube , Connecting Tube, Driving Tube And Dosing Tube, The Storage Tube Is Equipped With Several Explosives, The Reset Tube Is Equipped With A Spring And A Reset Block, The Connecting Tube Is Equipped With A Push Block, And The Driving Tube Is Equipped With A Driving Unit. The Plane Moving Mechanism Includes A Translation Assembly, A Conveyor Belt, With Movable Blocks And Two Sliding Units, The Highly Efficient Automated Military Drone Used For Mine Clearance Drives The Metal Detector To Move In A Plane Through A Plane Moving Mechanism, Thereby Speeding Up The Detection Speed. Not Only That, The Use Of The Drug Delivery Mechanism In The Explosive Box It Is Possible To Drop Explosives One By One, And Then Fly Out Of The Minefield For Detonation To Complete The Mine Clearance. Since The Drone Does Not Need To Return To Perform The Manipulator Replacement Operation, The Efficiency And Speed Of Mine Clearance Are Greatly Improved.","Jiangsu Huaxia Intellectual Property Service Co., Ltd",CN109539889A,2019/3/29 0:00,CN201710867987.0,2017/9/22 0:00,F41H11/136,F41H11/136;B64C27/08;B64D1/06
3357,Unmanned Aerial Vehicle Flexible Capture System And Use Method,"The Invention Relates To An Unmanned Aerial Vehicle Flexible Capture System. The Tail Of A Launching Cylinder Is Provided With A Central Hole, A Pull-Off Rod Passes Through The Central Hole From The Rear End Of The Launching Cylinder, And The Pull-Off Rod And The Launching Cylinder Are Sealed By A Sealing Gasket. Pass Through The Launch Tube And Connect And Fix The Tail Rod At The End Of The Catcher. The Front Part Of The Pull-Off Rod Is Provided With A Weakening Groove Along The Circumferential Direction. A Rear Plug Cover Is Installed At The Tail Of The Launch Tube. The Tube Tail Is Provided With A Ground Ejection Power Source Interface, And The Ground Ejection Power Source Interface Is Connected With The Ground Ejection Power Source Through A Switch Valve. The Present Invention Provides A Low-Altitude Defense Measure For Public Areas Such As Airports, Large Conference Venues, And Sensitive Areas, And To A Certain Extent Solves The Threat Of Low, Slow, And Small Flying Objects Such As Unmanned Reconnaissance Aircraft; The Present Invention Uses Ground High-Pressure Gas Ejection And The Measures Of Throwing Nets At High Altitudes Are Used To Capture Drones, Which Are Clean, Safe And Pollution-Free.",Inner Mongolia Institute of power machinery,CN109579620A,2019/4/5 0:00,CN201811490388.2,2018/12/6 0:00,F41H11/02,F41H11/02; F42B12/68
